<?xml version="1.0" encoding="UTF-8"?>

<xs:schema xmlns:xs="http://www.w3.org/2001/XMLSchema" elementFormDefault="qualified">
    <xs:element name="fadp-containers">
        <xs:complexType>
            <xs:sequence>
                <xs:element maxOccurs="unbounded" ref="container"/>
            </xs:sequence>
        </xs:complexType>
    </xs:element>
    <xs:element name="container">
        <xs:complexType>
            <xs:sequence>
                <xs:element minOccurs="0" maxOccurs="unbounded" ref="property"/>
            </xs:sequence>
            <xs:attributeGroup ref="attlist.container"/>
        </xs:complexType>
    </xs:element>
    <xs:attributeGroup name="attlist.container">
        <xs:attribute type="xs:string" name="name" use="required"/>
        <xs:attribute type="xs:string" name="class" use="required"/>
        <xs:attribute type="xs:string" name="loaders"/>
    </xs:attributeGroup>
    <xs:element name="property">
        <xs:complexType>
            <xs:sequence>
                <xs:element minOccurs="0" maxOccurs="unbounded" ref="property"/>
                <xs:element minOccurs="0" ref="property-value"/>
            </xs:sequence>
            <xs:attributeGroup ref="attlist.property"/>
        </xs:complexType>
    </xs:element>
    <xs:attributeGroup name="attlist.property">
        <xs:attribute type="xs:string" name="name" use="required"/>
        <xs:attribute type="xs:string" name="value"/>
    </xs:attributeGroup>
    <xs:element name="property-value" type="any"/>
    <xs:complexType name="any" mixed="true">
        <xs:sequence>
            <xs:any minOccurs="0" maxOccurs="unbounded" processContents="skip"/>
        </xs:sequence>
    </xs:complexType>
</xs:schema>
